{
  "schemaVersion": 1,
  "id": "io.dbx.files",
  "publisher": "jinpy",
  "version": "0.1.60",
  "name": "Files Studio",
  "description": "A unified file workspace for local folders, S3-compatible storage, Azure Blob, Google Cloud Storage, Huawei OBS, WebDAV, FTP, SFTP, SMB/CIFS, and other OpenDAL services.",
  "icon": "https://raw.githubusercontent.com/jinpy666/dbx-plugin-files/files-v0.1.60/assets/plugin.svg",
  "tags": [
    "files",
    "storage",
    "s3",
    "transfer"
  ],
  "permissions": [
    "host.workbench",
    "host.events",
    "host.binary",
    "host.filesystem"
  ],
  "source": "https://github.com/jinpy666/dbx-plugin-files",
  "homepage": "https://github.com/jinpy666/dbx-plugin-files",
  "license": "MIT",
  "releaseNotes": "新增 Google Cloud Storage、Azure Blob、华为 OBS，以及阿里云盘、Dropbox、Google Drive、Koofr、OneDrive、pCloud、Seafile、Yandex Disk 等 OpenDAL 云存储服务，并同步扩充连接表单契约与协议矩阵测试。Adds Google Cloud Storage, Azure Blob, Huawei OBS, plus Alibaba Drive, Dropbox, Google Drive, Koofr, OneDrive, pCloud, Seafile, and Yandex Disk, with expanded connection-form and protocol-matrix coverage.",
  "localizations": {
    "zh-CN": {
      "name": "Files Studio",
      "description": "统一管理本地文件夹、S3 兼容存储、Azure Blob、Google Cloud Storage、华为 OBS、WebDAV、FTP、SFTP、SMB/CIFS 等 OpenDAL 服务的文件工作台：传输任务、归档与受控运维集中在一个界面。"
    }
  },
  "targets": [
    {
      "target": "darwin-arm64",
      "url": "https://github.com/jinpy666/dbx-plugin-files/releases/download/files-v0.1.60/io.dbx.files-0.1.60-darwin-arm64.dbxp",
      "sha256": "ad19d270421e8d1f9eaafa5c4190b7dca56b3511ea3d5a74d27d42673bba8462",
      "size": 38583513
    },
    {
      "target": "darwin-x64",
      "url": "https://github.com/jinpy666/dbx-plugin-files/releases/download/files-v0.1.60/io.dbx.files-0.1.60-darwin-x64.dbxp",
      "sha256": "62add1297b06e1b1c03409031edba272f3038455352e156cfa95e73694536d77",
      "size": 41082609
    },
    {
      "target": "linux-arm64",
      "url": "https://github.com/jinpy666/dbx-plugin-files/releases/download/files-v0.1.60/io.dbx.files-0.1.60-linux-arm64.dbxp",
      "sha256": "8a5aa4591b998222e88fb755f2a29bb4b6b5c029869f58c611468f02f7f37679",
      "size": 34887068
    },
    {
      "target": "linux-x64",
      "url": "https://github.com/jinpy666/dbx-plugin-files/releases/download/files-v0.1.60/io.dbx.files-0.1.60-linux-x64.dbxp",
      "sha256": "b5710070f48554a307684ad9de49b987961a5c2b06dcf193f5d5aa3b77d7fb2b",
      "size": 37739052
    },
    {
      "target": "windows-x64",
      "url": "https://github.com/jinpy666/dbx-plugin-files/releases/download/files-v0.1.60/io.dbx.files-0.1.60-windows-x64.dbxp",
      "sha256": "a62e24d0a0bb0ad761690b7857e67d104c3cf48c476039ef92f08587b3bacb15",
      "size": 37278418
    }
  ]
}
