{
  "schemaVersion": 1,
  "id": "terry.devtools",
  "publisher": "terry",
  "version": "0.4.2",
  "name": "Dev Tools",
  "description": "A collection of everyday developer utilities: password/QR/barcode/UUID generators, hash, Base64, JWT parser, RMB uppercase, URL codec and image ⇄ Base64.",
  "icon": "https://raw.githubusercontent.com/yaoxinghuo/dbx-dev-tools/v0.4.2/assets/plugin.svg",
  "tags": [
    "devtools",
    "utilities",
    "encoding",
    "generator"
  ],
  "permissions": [],
  "source": "https://github.com/yaoxinghuo/dbx-dev-tools",
  "homepage": "https://github.com/yaoxinghuo/dbx-dev-tools",
  "license": "MIT",
  "releaseNotes": "Initial release with 10 tools: password, QR code, barcode, hash, UUID, Base64, JWT parser, RMB uppercase, URL codec and image ⇄ Base64.",
  "localizations": {
    "zh-CN": {
      "name": "Dev Tools",
      "description": "日常开发工具集合：密码/二维码/条码/UUID 生成、哈希计算、Base64、JWT 解析、人民币大写、URL 编解码、图片 ⇄ Base64。"
    }
  },
  "targets": [
    {
      "target": "universal",
      "url": "https://github.com/yaoxinghuo/dbx-dev-tools/releases/download/v0.4.2/terry.devtools-0.4.2-universal.dbxp",
      "sha256": "491fa41fc275a4c895700b2e98bc73b8142b4f14ad443c751fbf6a09d4b0a0e0",
      "size": 63415
    }
  ]
}
