{
  "schemaVersion": 1,
  "id": "io.dbx.nintyapi",
  "publisher": "nintycat",
  "version": "0.1.8",
  "name": "NintyAPI",
  "description": "在 DBX 里调试 HTTP 接口：接口集合树、完整请求历史（参数与响应一并留存）、cURL 互转、代码生成，分栏可拖拽，剪贴板与右键菜单都可用。",
  "icon": "https://raw.githubusercontent.com/NintyCat/dbx-plugin-NintyAPI/v0.1.8/assets/plugin.svg",
  "tags": [
    "http",
    "api",
    "rest",
    "testing",
    "debug"
  ],
  "permissions": [],
  "source": "https://github.com/NintyCat/dbx-plugin-NintyAPI",
  "homepage": "https://github.com/NintyCat/dbx-plugin-NintyAPI",
  "license": "Apache-2.0",
  "releaseNotes": "0.1.8：更换插件图标 —— 深色圆角底上的请求/响应双箭头，与 NintyShell 统一为同一视觉家族，小尺寸下更清晰。",
  "targets": [
    {
      "target": "darwin-arm64",
      "url": "https://github.com/NintyCat/dbx-plugin-NintyAPI/releases/download/v0.1.8/io.dbx.nintyapi-0.1.8-darwin-arm64.dbxp",
      "sha256": "150b84915250c0df27fa281a07c480d6ef27cdac98d056ad193b2f1be64e6ca5",
      "size": 4563003
    },
    {
      "target": "darwin-x64",
      "url": "https://github.com/NintyCat/dbx-plugin-NintyAPI/releases/download/v0.1.8/io.dbx.nintyapi-0.1.8-darwin-x64.dbxp",
      "sha256": "60fd7d8d3c71f1d9b17e5bf888aac59c8cd8e28ec1d80ad01578ea346c1eebdc",
      "size": 4783817
    },
    {
      "target": "linux-arm64",
      "url": "https://github.com/NintyCat/dbx-plugin-NintyAPI/releases/download/v0.1.8/io.dbx.nintyapi-0.1.8-linux-arm64.dbxp",
      "sha256": "c6ebd826252630ffd1c6404120d2e02b2c0aa6a0bf0db9b39a1e3573903a163c",
      "size": 4562002
    },
    {
      "target": "linux-x64",
      "url": "https://github.com/NintyCat/dbx-plugin-NintyAPI/releases/download/v0.1.8/io.dbx.nintyapi-0.1.8-linux-x64.dbxp",
      "sha256": "ec9889f17fac23f8fd88ed52de52514d5dc9f86ea9b28c2092934b26670ab51d",
      "size": 4859705
    },
    {
      "target": "windows-arm64",
      "url": "https://github.com/NintyCat/dbx-plugin-NintyAPI/releases/download/v0.1.8/io.dbx.nintyapi-0.1.8-windows-arm64.dbxp",
      "sha256": "948f88a0e7c498afd02f257c95dc7c8c93f367e99701f0b7f2db49c1a3cbc9f1",
      "size": 4550936
    },
    {
      "target": "windows-x64",
      "url": "https://github.com/NintyCat/dbx-plugin-NintyAPI/releases/download/v0.1.8/io.dbx.nintyapi-0.1.8-windows-x64.dbxp",
      "sha256": "96a9dee6c0521e80081c627644bde34458ee31088a29523886c138753eeaa20a",
      "size": 4880687
    }
  ]
}
