{
  "schemaVersion": 1,
  "id": "io.dbx.k8s",
  "publisher": "eryajf",
  "version": "0.1.2",
  "icon": "https://raw.githubusercontent.com/eryajf/dbx-plugin-k8s/v0.1.2/assets/plugin.png",
  "targets": [
    {
      "target": "darwin-arm64",
      "url": "https://github.com/eryajf/dbx-plugin-k8s/releases/download/v0.1.2/io.dbx.k8s-0.1.2-darwin-arm64.dbxp",
      "sha256": "5d51b3e4e7d8480c265065738b1d2f1391f9767a2a2be4b0937c87e9e1e13cae",
      "size": 31116086
    },
    {
      "target": "darwin-x64",
      "url": "https://github.com/eryajf/dbx-plugin-k8s/releases/download/v0.1.2/io.dbx.k8s-0.1.2-darwin-x64.dbxp",
      "sha256": "dd7c21aeec09fbfbbb37f959d0b33a355927ca4ecab8501b078c8b036f449a25",
      "size": 32316154
    },
    {
      "target": "linux-arm64",
      "url": "https://github.com/eryajf/dbx-plugin-k8s/releases/download/v0.1.2/io.dbx.k8s-0.1.2-linux-arm64.dbxp",
      "sha256": "6380f2d1810ed984ab5b62bbff7268c9176c7c0fd3705281c216e8aaf9e60e20",
      "size": 30676547
    },
    {
      "target": "linux-x64",
      "url": "https://github.com/eryajf/dbx-plugin-k8s/releases/download/v0.1.2/io.dbx.k8s-0.1.2-linux-x64.dbxp",
      "sha256": "a1dcc42f123d8f45a5edceb060e229b26f7fdb0c885360d40a278f279895d555",
      "size": 32295910
    },
    {
      "target": "windows-arm64",
      "url": "https://github.com/eryajf/dbx-plugin-k8s/releases/download/v0.1.2/io.dbx.k8s-0.1.2-windows-arm64.dbxp",
      "sha256": "f08803e6bd7c94d5c1e5e174bc1c4a9ec1df686bad62fcc2fde45e50763a981f",
      "size": 30707806
    },
    {
      "target": "windows-x64",
      "url": "https://github.com/eryajf/dbx-plugin-k8s/releases/download/v0.1.2/io.dbx.k8s-0.1.2-windows-x64.dbxp",
      "sha256": "ec081e30c6db4450ebe109f862209bb5afc45c4f45f1fdc198c6e168b8fc2818",
      "size": 32585244
    }
  ]
}
