{
  "schemaVersion": 1,
  "id": "io.dbx.ldap",
  "publisher": "jinpy",
  "version": "0.1.86",
  "name": "LDAP Studio",
  "description": "Browse, search, and manage LDAP directories: RFC 4515 filters, directory tree, schema inspection, guarded entry editing, and LDIF/CSV export.",
  "icon": "https://raw.githubusercontent.com/jinpy666/dbx-plugin-ldap/ldap-v0.1.86/assets/plugin.svg",
  "tags": [
    "ldap",
    "directory",
    "auth",
    "enterprise"
  ],
  "permissions": [
    "host.events",
    "host.workbench"
  ],
  "source": "https://github.com/jinpy666/dbx-plugin-ldap",
  "homepage": "https://github.com/jinpy666/dbx-plugin-ldap",
  "license": "MIT",
  "releaseNotes": "首个商店版本：LDAP 目录浏览与管理工作台。DN 树浏览、分页搜索与 RFC 4515 过滤器；条目查看、新增、编辑、重命名与删除；RootDSE/Schema 检查与 LDIF/CSV 导出；支持 anonymous、simple、Kerberos/GSSAPI、NTLM、DIGEST-MD5、SASL External 等认证矩阵与 LDAP/StartTLS/LDAPS；内置只读模式、Base DN 白名单、屏蔽属性和审计等安全护栏，支持粘贴 ldapsearch 命令一键导入搜索表单，并提供 MCP 工具面供 AI 客户端复用。",
  "localizations": {
    "zh-CN": {
      "name": "LDAP Studio",
      "description": "用于浏览、搜索和管理 LDAP 目录：支持 RFC 4515 过滤器、Schema 检查、条目编辑、LDIF/CSV 导出和受控写入。"
    }
  },
  "targets": [
    {
      "target": "darwin-arm64",
      "url": "https://github.com/jinpy666/dbx-plugin-ldap/releases/download/ldap-v0.1.86/io.dbx.ldap-0.1.86-darwin-arm64.dbxp",
      "sha256": "44ce0d87530ab2dc3bdc9f6600cdba076d6fb47869a4ac418a67c2a36f185a88",
      "size": 6342707
    },
    {
      "target": "darwin-x64",
      "url": "https://github.com/jinpy666/dbx-plugin-ldap/releases/download/ldap-v0.1.86/io.dbx.ldap-0.1.86-darwin-x64.dbxp",
      "sha256": "8faf218b7f2fec1d3ebd050301d5789e7c6b1f556cabe6bffbfcd6475410444b",
      "size": 6662190
    },
    {
      "target": "linux-arm64",
      "url": "https://github.com/jinpy666/dbx-plugin-ldap/releases/download/ldap-v0.1.86/io.dbx.ldap-0.1.86-linux-arm64.dbxp",
      "sha256": "e9ed13a5de0f34d99ec49de7cc56baff7c067ea4d9800769e3b8cbc1686bde9f",
      "size": 6329573
    },
    {
      "target": "linux-x64",
      "url": "https://github.com/jinpy666/dbx-plugin-ldap/releases/download/ldap-v0.1.86/io.dbx.ldap-0.1.86-linux-x64.dbxp",
      "sha256": "ecbe30c9ff453cdea58447165afa67af6a196c862fd297d4d56159f3f30b2363",
      "size": 6751944
    },
    {
      "target": "windows-x64",
      "url": "https://github.com/jinpy666/dbx-plugin-ldap/releases/download/ldap-v0.1.86/io.dbx.ldap-0.1.86-windows-x64.dbxp",
      "sha256": "6528f650a1a261fc8f0972036a062b8b2aeee0e186a901cf5d17983dc085a23a",
      "size": 6800925
    }
  ]
}
