{
  "schemaVersion": 1,
  "id": "io.dbx.kafka",
  "publisher": "jinpy",
  "version": "0.1.43",
  "name": "Kafka Studio",
  "description": "Operate Apache Kafka from one workspace: inspect topics and partitions, produce and consume messages, filter and decode payloads, monitor consumer lag, manage offsets and ACLs, stream records, and export results.",
  "icon": "https://raw.githubusercontent.com/jinpy666/dbx-plugin-kafka/kafka-v0.1.43/assets/plugin.svg",
  "tags": [
    "kafka",
    "streaming",
    "messaging",
    "schema-registry"
  ],
  "permissions": [
    "host.events",
    "host.workbench"
  ],
  "source": "https://github.com/jinpy666/dbx-plugin-kafka",
  "homepage": "https://github.com/jinpy666/dbx-plugin-kafka",
  "license": "MIT",
  "releaseNotes": "修复深色主题下 Topic 侧栏不可读的问题：图标色随 color-scheme 自动翻转，核心颜色令牌改为实时跟随宿主主题（不再被内联快照冻结），并提升树行/星标对比度。消息查询新增「最近 N 条」Offset 策略并设为默认：原「最新」策略从日志末端只等待新消息，对没有持续流量的 topic 总是「已扫描 0 · 命中 0」，现在默认即可读到每个分区最新的历史记录。Fixed topics sidebar legibility in dark theme: icon hues follow color-scheme, core color tokens now track the host theme live instead of being frozen by an inline snapshot, and tree row/star contrast was raised. Messages query adds a recent-N offset strategy and defaults to it: the previous latest default only waited for new records and always scanned zero on idle topics; the new default surfaces the newest existing records per partition.",
  "localizations": {
    "zh-CN": {
      "name": "Kafka Studio",
      "description": "在一个工作台中管理 Apache Kafka：查看 topic 与分区、生产和消费消息、过滤与解码 payload、监控消费组 lag、管理 offset 和 ACL、流式消费并导出结果。"
    },
    "zh-TW": {
      "name": "Kafka Studio",
      "description": "DBX 的 Kafka 主控台外掛：topic 與分割區、訊息生產與消費（過濾/解碼）、消費組（lag 與 offset 重置）、ACL、串流消費與匯出。"
    },
    "en": {
      "name": "Kafka Studio",
      "description": "Operate Apache Kafka from one workspace: inspect topics and partitions, produce and consume messages, filter and decode payloads, monitor consumer lag, manage offsets and ACLs, stream records, and export results."
    },
    "es": {
      "name": "Kafka Studio",
      "description": "Plugin de consola Kafka para DBX: topics y particiones, producción/consumo de mensajes con filtros y decodificación, grupos de consumidores con lag y reset de offsets, ACL, consumo en streaming y exportación."
    },
    "it": {
      "name": "Kafka Studio",
      "description": "Plugin console Kafka per DBX: topic e partizioni, produzione/consumo di messaggi con filtri e decodifica, gruppi di consumatori con lag e reset degli offset, ACL, consumo in streaming ed esportazione."
    },
    "ja": {
      "name": "Kafka Studio",
      "description": "DBX 用 Kafka コンソールプラグイン: トピックとパーティション、フィルタリング/デコード付きメッセージ送受信、コンシューマーグループ（ラグと offset リセット）、ACL、ストリーミング消費とエクスポート。"
    },
    "pt-BR": {
      "name": "Kafka Studio",
      "description": "Plugin de console Kafka para o DBX: tópicos e partições, produção/consumo de mensagens com filtros e decodificação, grupos de consumidores com lag e redefinição de offsets, ACLs, consumo em streaming e exportação."
    }
  },
  "targets": [
    {
      "target": "darwin-arm64",
      "url": "https://github.com/jinpy666/dbx-plugin-kafka/releases/download/kafka-v0.1.43/io.dbx.kafka-0.1.43-darwin-arm64.dbxp",
      "sha256": "200e57789e3229eb6045d60c4b28658e8a377439ec204d29198ead5bfcbe16fc",
      "size": 13278108
    },
    {
      "target": "darwin-x64",
      "url": "https://github.com/jinpy666/dbx-plugin-kafka/releases/download/kafka-v0.1.43/io.dbx.kafka-0.1.43-darwin-x64.dbxp",
      "sha256": "a22dea0fa515dee84028a14f222bbb54098f635eb840f897f88f6a8989e19141",
      "size": 14085681
    },
    {
      "target": "linux-arm64",
      "url": "https://github.com/jinpy666/dbx-plugin-kafka/releases/download/kafka-v0.1.43/io.dbx.kafka-0.1.43-linux-arm64.dbxp",
      "sha256": "aa6fd3a0d8a440d6d0e3ad1731a8efd28864dc689f5ec7772e4f864d1b851711",
      "size": 12513697
    },
    {
      "target": "linux-x64",
      "url": "https://github.com/jinpy666/dbx-plugin-kafka/releases/download/kafka-v0.1.43/io.dbx.kafka-0.1.43-linux-x64.dbxp",
      "sha256": "bed36c4c32ebf9ec2aa24db3b2b5edf01675258cdbc69726889e1a897595d3a1",
      "size": 13593977
    },
    {
      "target": "windows-x64",
      "url": "https://github.com/jinpy666/dbx-plugin-kafka/releases/download/kafka-v0.1.43/io.dbx.kafka-0.1.43-windows-x64.dbxp",
      "sha256": "78a9f904b10069fca3f221440e59cd42a0991264abd1ff5e3c2addd355f71114",
      "size": 13678478
    }
  ]
}
